{
  "schema_version": "0.1.0",
  "trace_id": "67a58ac9f2c648bcfca4104ddf6d16b6",
  "response_id": "e795758aa7cf98b7c88c1f19615bf1ef04548419a48001e53c36be9c1d349a28",
  "evaluator": {
    "name": "ragproof-claim-verifier",
    "version": "lexical-numeric-0.1.1"
  },
  "claims": [
    {
      "claim_id": "b64499d4267e46e9c03016fe3c2442a2054ea34c1cefa068f41c95d0090447b0",
      "text": "Agreement, which notice must be given not less than thirty (30) days before the end of the respective initial or renewal term.",
      "verdict": "CONTRADICTED",
      "confidence": 1.0,
      "evidence": [
        {
          "chunk_id": "cuad-contract-99dea8d7575f:cuad-v1:f8161d18bea4:block:0:chunk:8",
          "relation": "contradicts",
          "document_version": "cuad-v1:f8161d18bea4",
          "freshness": "current"
        }
      ],
      "explanation": "A closely matching evidence statement contains conflicting numeric terms.",
      "judge_disagreement": false
    }
  ]
}
